{
  "schema": 1,
  "kind": "software-lifecycle-human-authority-receipt",
  "receiptId": "lifecycle-zero-model-domain-fixture-calibration-v2-2026-07-27-G3-implementation-mutation-envelope",
  "runId": "lifecycle-zero-model-domain-fixture-calibration-v2-2026-07-27",
  "gateId": "G3-implementation-mutation-envelope",
  "stageId": "SE-TS-03-implementation-tdd",
  "sequence": 3,
  "decision": "approve",
  "decisionClass": "bounded-local-mutation",
  "proposalArtifactCanonicalSha256": "c20386e9405999fb2a5757f359835adf42f7b34361ce161e64d0407e4f61b135",
  "beforeAcceptedLedgerSha256": "f95630568df3e0c44d2bda95aae2240a15699aa35ca0de06f26d09a24c8de85d",
  "allowedChangeIds": [],
  "rejectedChangeIds": [],
  "scope": {
    "stageIds": [
      "SE-TS-03-implementation-tdd"
    ],
    "artifactIds": [
      "lifecycle-zero-model-domain-fixture-calibration-v2-2026-07-27-O3"
    ],
    "actions": [
      "exact-disposable-local-file-allowlist",
      "read-only-independent-verification"
    ]
  },
  "inputArtifactDigests": [
    "c20386e9405999fb2a5757f359835adf42f7b34361ce161e64d0407e4f61b135"
  ],
  "conditions": [
    "synthetic-zero-model-calibration-only"
  ],
  "issuer": {
    "subjectId": "synthetic-calibration-authority",
    "accountableRole": "disposable-workspace-owner",
    "evidenceClass": "synthetic-calibration-authority"
  },
  "issuedAt": "2026-07-27T00:00:03+00:00",
  "expiresAt": null,
  "singleUse": true,
  "simulated": true,
  "receiptSha256": "7bbe94e30cf793f1a07864aa97fbda9458c9dfc64a101a4f4ace0ad54372ff6a"
}
