{
  "schema": 1,
  "kind": "software-lifecycle-human-authority-receipt",
  "receiptId": "lifecycle-zero-model-domain-fixture-calibration-v2-2026-07-27-G6-simulated-fault-and-recovery-decision",
  "runId": "lifecycle-zero-model-domain-fixture-calibration-v2-2026-07-27",
  "gateId": "G6-simulated-fault-and-recovery-decision",
  "stageId": "SE-TS-06-observation-incident-handling",
  "sequence": 6,
  "decision": "approve",
  "decisionClass": "simulated-fault-recovery",
  "proposalArtifactCanonicalSha256": "35a114380e61c327afdb826632488d5e45096742ff1234caa2a3384eaf6d0058",
  "beforeAcceptedLedgerSha256": "c58d506a01e9282ea6a8b830cf4b211271898471d0dc2288ceaaf419ec82261b",
  "allowedChangeIds": [
    "accept-stage-6"
  ],
  "rejectedChangeIds": [],
  "scope": {
    "stageIds": [
      "SE-TS-06-observation-incident-handling"
    ],
    "artifactIds": [
      "lifecycle-zero-model-domain-fixture-calibration-v2-2026-07-27-O6"
    ],
    "actions": [
      "predeclared-disposable-fault-injection",
      "bounded-local-recovery"
    ]
  },
  "inputArtifactDigests": [
    "35a114380e61c327afdb826632488d5e45096742ff1234caa2a3384eaf6d0058"
  ],
  "conditions": [
    "synthetic-zero-model-calibration-only"
  ],
  "issuer": {
    "subjectId": "synthetic-calibration-authority",
    "accountableRole": "operator-and-incident-authority",
    "evidenceClass": "synthetic-calibration-authority"
  },
  "issuedAt": "2026-07-27T00:00:06+00:00",
  "expiresAt": null,
  "singleUse": true,
  "simulated": true,
  "receiptSha256": "7b49ab049a45db1465fc458aeec762ce97f78993205b0772dd62a968073630cc"
}
