{
  "schema": 1,
  "kind": "software-lifecycle-human-authority-receipt",
  "receiptId": "SE-E2E-THIN-01-ZERO-001-G4-independent-acceptance-and-risk-decision",
  "runId": "SE-E2E-THIN-01-ZERO-001",
  "gateId": "G4-independent-acceptance-and-risk-decision",
  "stageId": "SE-TS-04-independent-review-test-security",
  "sequence": 4,
  "decision": "approve",
  "decisionClass": "risk-acceptance",
  "proposalArtifactCanonicalSha256": "cba31b20624f650524bd8695349769c6701e267a4bacb6f9c139b2befb95c705",
  "beforeAcceptedLedgerSha256": "821f3063600755f95791c9206badadb77660f54633a41af00e9f0bb9584028ef",
  "allowedChangeIds": [
    "accept-stage-4"
  ],
  "rejectedChangeIds": [],
  "scope": {
    "stageIds": [
      "SE-TS-04-independent-review-test-security"
    ],
    "artifactIds": [
      "SE-E2E-THIN-01-ZERO-001-O4"
    ],
    "actions": [
      "release-planning"
    ]
  },
  "inputArtifactDigests": [
    "cba31b20624f650524bd8695349769c6701e267a4bacb6f9c139b2befb95c705"
  ],
  "conditions": [
    "synthetic-zero-model-calibration-only"
  ],
  "issuer": {
    "subjectId": "synthetic-calibration-authority",
    "accountableRole": "accountable-verification-and-security-authority",
    "evidenceClass": "synthetic-calibration-authority"
  },
  "issuedAt": "2026-07-27T00:00:04+00:00",
  "expiresAt": null,
  "singleUse": true,
  "simulated": true,
  "receiptSha256": "3c55151a5652648d9825360a187693cdc1a2fb317eb4ee524688bc92fd8ad546"
}
