{
  "schema": 1,
  "kind": "software-lifecycle-human-authority-receipt",
  "receiptId": "lifecycle-zero-model-domain-fixture-calibration-v2-2026-07-27-G7-maintenance-deprecation-decision",
  "runId": "lifecycle-zero-model-domain-fixture-calibration-v2-2026-07-27",
  "gateId": "G7-maintenance-deprecation-decision",
  "stageId": "SE-TS-07-maintenance-evolution",
  "sequence": 7,
  "decision": "approve",
  "decisionClass": "maintenance-disposition",
  "proposalArtifactCanonicalSha256": "4d8b1ca3aac61674d5ec65fa67ab04a606d974b70c1e322d5cdf3724a9e6b4cd",
  "beforeAcceptedLedgerSha256": "8ce6c640d066cdfebbe08187c09ec71e1ed2c03023b1360c7897aae1b4960149",
  "allowedChangeIds": [
    "accept-stage-7"
  ],
  "rejectedChangeIds": [],
  "scope": {
    "stageIds": [
      "SE-TS-07-maintenance-evolution"
    ],
    "artifactIds": [
      "lifecycle-zero-model-domain-fixture-calibration-v2-2026-07-27-O7"
    ],
    "actions": [
      "maintenance-decision-record"
    ]
  },
  "inputArtifactDigests": [
    "4d8b1ca3aac61674d5ec65fa67ab04a606d974b70c1e322d5cdf3724a9e6b4cd"
  ],
  "conditions": [
    "synthetic-zero-model-calibration-only"
  ],
  "issuer": {
    "subjectId": "synthetic-calibration-authority",
    "accountableRole": "product-service-maintenance-owner",
    "evidenceClass": "synthetic-calibration-authority"
  },
  "issuedAt": "2026-07-27T00:00:07+00:00",
  "expiresAt": null,
  "singleUse": true,
  "simulated": true,
  "receiptSha256": "fbafae4e0aa6180aba3eab04af125cd317af5cd438b30642432de501539e37d2"
}
