{
  "schema": 1,
  "kind": "software-lifecycle-human-authority-receipt",
  "receiptId": "lifecycle-zero-model-domain-fixture-calibration-v2-2026-07-27-G5-simulated-release-and-rollback-decision",
  "runId": "lifecycle-zero-model-domain-fixture-calibration-v2-2026-07-27",
  "gateId": "G5-simulated-release-and-rollback-decision",
  "stageId": "SE-TS-05-release-rollback-gating",
  "sequence": 5,
  "decision": "approve",
  "decisionClass": "simulated-release",
  "proposalArtifactCanonicalSha256": "81e82abcd2ff1e246495d5df498ea8c4f0c0900704a5978b1b4ff58788e7cdaf",
  "beforeAcceptedLedgerSha256": "38a84edeb9931b5f98690e7be17447db9c0b42da15075caed43aeb33bcc6cb95",
  "allowedChangeIds": [
    "accept-stage-5"
  ],
  "rejectedChangeIds": [],
  "scope": {
    "stageIds": [
      "SE-TS-05-release-rollback-gating"
    ],
    "artifactIds": [
      "lifecycle-zero-model-domain-fixture-calibration-v2-2026-07-27-O5"
    ],
    "actions": [
      "local-simulated-release",
      "local-rollback-exercise"
    ]
  },
  "inputArtifactDigests": [
    "81e82abcd2ff1e246495d5df498ea8c4f0c0900704a5978b1b4ff58788e7cdaf"
  ],
  "conditions": [
    "synthetic-zero-model-calibration-only"
  ],
  "issuer": {
    "subjectId": "synthetic-calibration-authority",
    "accountableRole": "release-and-operator-authority",
    "evidenceClass": "synthetic-calibration-authority"
  },
  "issuedAt": "2026-07-27T00:00:05+00:00",
  "expiresAt": null,
  "singleUse": true,
  "simulated": true,
  "receiptSha256": "b0272261cd5d280659a57f4d8bdf28f20102643faee03d24f9db56de7d11a8ce"
}
